<?xml version="1.0" encoding="UTF-8"?>
<xs:schema xmlns:xs="http://www.w3.org/2001/XMLSchema">

  <xs:element name="items">
    <xs:complexType>
      <xs:sequence maxOccurs="unbounded">
        <xs:element ref="item"/>
      </xs:sequence>
    </xs:complexType>
  </xs:element>

  <xs:element name="item">
    <xs:complexType>
      <xs:sequence>
        <xs:element ref="nombre"/>
        <xs:element ref="tipo"/>
        <xs:element ref="precio"/>
      </xs:sequence>
      <xs:attribute name="id" type="xs:string" use="required"/>
    </xs:complexType>
  </xs:element>

  <xs:element name="nombre" type="xs:string"/>

  <xs:element name="tipo" type="xs:string"/>

  <xs:element name="precio" type="xs:string"/>

</xs:schema>
